{
  "schema_version": "argus.candidate_verification_ledger.v1alpha1",
  "verification_ledger_id": "verification-ledger-dacdd5f252875ad0feda4c67",
  "review_run_id": "formal-run-example",
  "execution_id": "execution-example",
  "hypothesis_set_id": "hypothesis-set-example",
  "target_digest": "aaaaaaaaaaaaaaaaaaaaaaaaaaaaaaaaaaaaaaaaaaaaaaaaaaaaaaaaaaaaaaaa",
  "completeness": "complete",
  "summary": {
    "candidates": 0,
    "confirmed": 0,
    "rejected": 0,
    "inconclusive": 0,
    "unverified": 0
  },
  "facts": [],
  "generated_at": "2026-08-25T01:02:03Z"
}
